{
  "schema_version": 1,
  "stage": 1,
  "name": "无损 DSL、模板定义和三份配置状态",
  "required_documents": [
    "todo/second_order_tank_agent_start_here.md",
    "todo/second_order_tank_visual_dsl_template_design.md",
    "todo/second_order_tank_repository_contracts.md",
    "todo/second_order_tank_implementation_playbook.md"
  ],
  "allowed_paths": [
    "config-tool/internal/config/**",
    "config-tool/internal/bindings/template_config.go",
    "config-tool/internal/app/container.go",
    "config-tool/main.go",
    "config-tool/go.mod",
    "config-tool/go.sum",
    "config-tool/frontend/src/App.tsx",
    "config-tool/frontend/src/features/templates/**",
    "config-tool/frontend/src/lib/api.ts",
    "config-tool/frontend/src/style.css",
    "config-tool/frontend/wailsjs/**",
    "config-tool/frontend/package.json.md5",
    "tests/test_structured_dsl.py",
    "tests/test_tank_pid_configs.py"
  ],
  "forbidden_paths": [
    "components/programs/pid.py",
    "components/programs/valve.py",
    "components/programs/cylindrical_tank.py",
    "components/programs/base.py",
    "datacenter/opcua_server.py",
    "config/单阀门二阶水箱.yaml",
    "debug_gui/**",
    "config-tool/frontend/src/features/runtime/**"
  ],
  "preserved_paths": [
    "config-tool/frontend/src/components/Canvas.tsx",
    "config-tool/frontend/src/components/Palette.tsx",
    "config-tool/frontend/src/components/PropertyPanel.tsx",
    "config-tool/frontend/src/components/SimulationPanel.tsx",
    "config-tool/frontend/src/store/useCanvasStore.ts"
  ],
  "required_paths": [
    "config-tool/internal/config/template_service.go",
    "config-tool/internal/config/template_service_test.go",
    "config-tool/frontend/src/features/templates/useTemplateStore.ts",
    "config-tool/frontend/src/features/templates/secondOrderTank/definition.ts"
  ],
  "forbidden_symbols": [
    {
      "id": "no_stage_2_pid_diagram",
      "path_globs": [
        "config-tool/frontend/src/features/templates/**"
      ],
      "pattern": "SecondOrderTankDiagram|SecondOrderTankInspector|RuntimeToolbar|<svg"
    }
  ],
  "locked_paths": [
    "todo/second_order_tank_*.md",
    "tools/stage_verification/**"
  ],
  "locked_acceptance_paths": [
    "tools/stage_verification/acceptance/SECOND_ORDER_TANK_ACCEPTANCE_SPEC.md",
    "tools/stage_verification/acceptance/CONTRACT_SURFACES.md",
    "tools/stage_verification/acceptance/stage_0/test_stage_0_acceptance.py",
    "config-tool/frontend/acceptance/stage_0/api_wrapper.acceptance.test.ts",
    "config-tool/frontend/acceptance/stage_0/legacy_views.acceptance.test.tsx",
    "tools/stage_verification/acceptance/stage_1/test_stage_1_acceptance.py",
    "config-tool/acceptance/stage_1/template_service_acceptance_test.go",
    "config-tool/frontend/acceptance/stage_1/template_store.acceptance.test.ts"
  ],
  "commands": [
    {
      "id": "verifier_self_tests",
      "cwd": ".",
      "argv": [
        "{python}",
        "-m",
        "pytest",
        "tools/stage_verification/tests",
        "-q"
      ],
      "timeout_seconds": 300
    },
    {
      "id": "python_reviewer_acceptance",
      "cwd": ".",
      "argv": [
        "{python}",
        "-m",
        "pytest",
        "tools/stage_verification/acceptance/stage_1",
        "-q"
      ],
      "timeout_seconds": 300
    },
    {
      "id": "go_reviewer_acceptance",
      "cwd": "config-tool",
      "argv": [
        "go",
        "test",
        "./acceptance/stage_1/...",
        "-count=1"
      ],
      "timeout_seconds": 300,
      "env": {
        "GOCACHE": "{temp}/review3-go-cache"
      }
    },
    {
      "id": "frontend_reviewer_acceptance",
      "cwd": "config-tool/frontend",
      "argv": [
        "npm",
        "run",
        "test:acceptance",
        "--",
        "acceptance/stage_1"
      ],
      "windows_argv": [
        "npm.cmd",
        "run",
        "test:acceptance",
        "--",
        "acceptance/stage_1"
      ],
      "timeout_seconds": 300
    },
    {
      "id": "frontend_tests",
      "cwd": "config-tool/frontend",
      "argv": [
        "npm",
        "run",
        "test:run"
      ],
      "windows_argv": [
        "npm.cmd",
        "run",
        "test:run"
      ],
      "timeout_seconds": 300
    },
    {
      "id": "frontend_build",
      "cwd": "config-tool/frontend",
      "argv": [
        "npm",
        "run",
        "build"
      ],
      "windows_argv": [
        "npm.cmd",
        "run",
        "build"
      ],
      "timeout_seconds": 300
    },
    {
      "id": "go_template",
      "cwd": "config-tool",
      "argv": [
        "go",
        "test",
        "./internal/config",
        "./internal/bindings"
      ],
      "timeout_seconds": 300,
      "env": {
        "GOCACHE": "{temp}/review3-go-cache"
      }
    },
    {
      "id": "wails_build",
      "cwd": "config-tool",
      "argv": [
        "wails",
        "build"
      ],
      "timeout_seconds": 600,
      "env": {
        "GOCACHE": "{temp}/review3-go-cache"
      }
    },
    {
      "id": "python_dsl",
      "cwd": ".",
      "argv": [
        "{python}",
        "-m",
        "pytest",
        "tests/test_structured_dsl.py",
        "tests/test_tank_pid_configs.py",
        "-q"
      ],
      "timeout_seconds": 300
    }
  ],
  "git_diff_check": true,
  "gates": [
    {
      "id": "scope_and_stage_boundary",
      "mode": "automated",
      "description": "修改局限于无损模板服务和模板状态，且未提前实现阶段 2。",
      "checks": [
        "required_documents",
        "required_paths",
        "preserved_paths",
        "manifest_locked",
        "locked_files",
        "locked_acceptance_files",
        "changed_paths_allowed",
        "forbidden_paths",
        "forbidden_symbols",
        "git_diff_check"
      ]
    },
    {
      "id": "lossless_and_state_contract",
      "mode": "automated",
      "description": "无损 YAML、冲突保护、三份状态、校验和回归由 Go、前端和 Python 测试证明。",
      "checks": [
        "command:verifier_self_tests",
        "command:python_reviewer_acceptance",
        "command:go_reviewer_acceptance",
        "command:frontend_reviewer_acceptance",
        "command:frontend_tests",
        "command:frontend_build",
        "command:go_template",
        "command:wails_build",
        "command:python_dsl"
      ]
    }
  ]
}
