{
  "schema_version": 1,
  "stage": 5,
  "name": "原子在线写值和调参写回 DSL",
  "required_documents": ["todo/second_order_tank_agent_start_here.md", "todo/second_order_tank_visual_dsl_template_design.md", "todo/second_order_tank_repository_contracts.md", "todo/second_order_tank_implementation_playbook.md"],
  "allowed_paths": ["controller/engine.py", "datacenter/engine_api.py", "tests/test_engine_atomic_writes.py", "tests/test_*writes*.py", "config-tool/frontend/src/features/runtime/**", "config-tool/frontend/src/features/templates/**", "config-tool/internal/config/**", "config-tool/internal/bindings/template_config.go", "config-tool/frontend/wailsjs/**", "config-tool/frontend/package.json.md5", "config-tool/go.mod", "config-tool/go.sum"],
  "forbidden_paths": ["components/programs/pid.py", "components/programs/valve.py", "components/programs/cylindrical_tank.py", "components/programs/base.py", "datacenter/opcua_server.py", "config/单阀门二阶水箱.yaml", "debug_gui/**", "config-tool/internal/bindings/system.go"],
  "preserved_paths": ["config-tool/frontend/src/components/Canvas.tsx", "config-tool/frontend/src/components/Palette.tsx", "config-tool/frontend/src/components/PropertyPanel.tsx", "config-tool/frontend/src/components/SimulationPanel.tsx", "config-tool/frontend/src/store/useCanvasStore.ts"],
  "required_paths": ["tests/test_engine_atomic_writes.py", "config-tool/frontend/src/features/templates/PidFaceplate.tsx"],
  "forbidden_symbols": [{"id": "no_stage_6_quality_dashboard", "path_globs": ["config-tool/frontend/src/**"], "pattern": "RuntimeTrendPanel|previousRunSeries|settlingTime|controlQuality|downsample"}],
  "locked_paths": ["todo/second_order_tank_*.md", "tools/stage_verification/**"],
  "locked_acceptance_paths": ["tests/test_*.py", "config-tool/frontend/src/**/*.test.ts", "config-tool/frontend/src/**/*.test.tsx", "config-tool/internal/**/*_test.go", "tools/stage_verification/acceptance/stage_5/test_atomic_writes_acceptance.py", "tools/stage_verification/acceptance/stage_5/test_pid_faceplate_acceptance.py"],
  "commands": [
    {"id": "locked_acceptance", "cwd": ".", "argv": ["{python}", "-m", "pytest", "tools/stage_verification/acceptance/stage_5", "-q"], "timeout_seconds": 300},
    {"id": "python_atomic_writes", "cwd": ".", "argv": ["{python}", "-m", "pytest", "tests/test_engine_api.py", "tests/test_engine_atomic_writes.py", "tests/test_tank_pid_configs.py", "tests/test_pid_industrial.py", "tests/test_structured_dsl.py", "-q"], "timeout_seconds": 300},
    {"id": "frontend_tests", "cwd": "config-tool/frontend", "argv": ["npm", "run", "test:run"], "windows_argv": ["npm.cmd", "run", "test:run"], "timeout_seconds": 300},
    {"id": "frontend_build", "cwd": "config-tool/frontend", "argv": ["npm", "run", "build"], "windows_argv": ["npm.cmd", "run", "build"], "timeout_seconds": 300},
    {"id": "go_all", "cwd": "config-tool", "argv": ["go", "test", "./..."], "timeout_seconds": 300, "env": {"GOCACHE": "{temp}/review3-go-cache"}}
  ],
  "git_diff_check": true,
  "gates": [
    {"id": "scope_and_stage_boundary", "mode": "automated", "description": "只实现在线写值和白名单写回，未提前加入趋势与控制品质。", "checks": ["required_documents", "required_paths", "preserved_paths", "manifest_locked", "locked_files", "locked_acceptance_files", "changed_paths_allowed", "forbidden_paths", "forbidden_symbols", "git_diff_check"]},
    {"id": "atomic_write_contract", "mode": "automated", "description": "整批验证/入队/周期应用、模式约束、snapshot 确认、事件状态和 DSL 白名单写回均通过测试。", "checks": ["command:locked_acceptance", "command:python_atomic_writes", "command:frontend_tests", "command:frontend_build", "command:go_all"]}
  ]
}
